Contract,Question,Answer,Source Page No,Evaluation Azure,Result Azure,Evaluation Chroma,Result Chroma,Question Category,LightRAG_naive_response,lightRag_similarity_scores,LightRAG_evaluation_result
contract sample-2.pdf,Does the Lessor provide a warranty of merchantability or fitness for the Aircraft?,No Warranty of Merchantability or Fitness: The Lessor disclaims any warranty of merchantability or fitness for a particular purpose.,7,Yes," Based on the information provided in the lease agreement, the Lessor does not explicitly state that they provide a warranty of merchantability or fitness for the Aircraft. However, the Lessee is responsible for ensuring that the Aircraft is in good condition, meets commercial passenger standards, and is returned in an airworthy state with all required documentation and compliance with regulatory authorities. The Lessee also bears the costs of any repairs and is responsible for maintaining accurate and up-to-date maintenance records. Therefore, it can be inferred that the responsibility for the aircraft's merchantability and fitness lies with the Lessee rather than the Lessor.",No," Based on the information provided in the lease agreement, the lessor does not explicitly provide a warranty of merchantability or fitness for the aircraft. However, the lessee confirms that the aircraft is in airworthy condition and meets the delivery conditions specified in the lease agreement. The aircraft is also certified as compliant with applicable regulations and airworthiness standards. The lessee acknowledges and accepts delivery of the aircraft in satisfactory condition for commercial operations. The lessee is responsible for maintaining the aircraft in good condition, completing all scheduled maintenance, and complying with all airworthiness directives and service bulletins. The lessee also bears all costs associated with maintaining, repairing, and operating the aircraft.",Specific/Factual,"No, the Lessor does not provide a warranty of merchantability or fitness for the Aircraft. According to Section 5 of the Aircraft Lease Agreement, the Aircraft is leased on an ""AS-IS, WHERE-IS"" basis, and the Lessor explicitly disclaims any warranty of merchantability or fitness for a particular purpose. This means that the Lessee accepts the Aircraft in its current condition without any guarantees from the Lessor regarding its suitability for any specific use or its overall quality. 

This disclaimer is important for the Lessee to understand, as it places the responsibility for assessing the Aircraft's condition and suitability solely on them. The Lessee is expected to conduct their own inspections and evaluations before taking possession of the Aircraft.",tensor(0.9362),No
contract sample-2.pdf,Are there any express warranties mentioned in this Agreement?,"The Lessor makes no representations or warranties, express or implied, with respect to the Aircraft, except as expressly stated in this Agreement.",7,Yes," Based on the provided text, there are no specific mentions of express warranties in the agreement. However, there is a disclaimer section (Section 5) where the Lessor states that they make no express or implied warranties, except as expressly stated in the agreement.",Yes," Based on the provided text, there is no explicit mention of express warranties in the agreement. However, there are provisions regarding insurance coverage and tax liabilities, which may imply certain warranties or guarantees, but they are not labelled as express warranties in the text. Therefore, I cannot definitively answer whether express warranties are mentioned in the agreement without additional context.",Specific/Factual,"In the Aircraft Lease Agreement between AeroSky Rentals Ltd. (the Lessor) and BlueJet Airways Corp. (the Lessee), there are no express warranties provided by the Lessor regarding the Aircraft. Specifically, Section 5 of the Agreement states that the Aircraft is leased on an ""AS-IS, WHERE-IS"" basis. This means that the Lessor makes no representations or warranties, whether express or implied, concerning the Aircraft, except for those explicitly stated in the Agreement.

Furthermore, the Lessor disclaims any warranty of merchantability or fitness for a particular purpose. This indicates that the Lessee accepts the Aircraft in its current condition without any guarantees from the Lessor about its performance or suitability for specific uses. 

In summary, the Agreement clearly outlines that the Lessor does not provide any express warranties, placing the responsibility on the Lessee to accept the Aircraft as it is.",tensor(0.9427),No
contract sample-2.pdf,When does the Lessee take possession of the Aircraft?,The Lessee shall take possession of the Aircraft on the Delivery Date and shall be responsible for its condition from that date onward.,8,Yes," The Lessee takes possession of the Aircraft upon acceptance by the Lessor after the fulfillment of all delivery and acceptance conditions, as outlined in Section 3 of the Lease Agreement. In the given scenario, the Lessee has provided all necessary documentation, and the Lessor has acknowledged and accepted the redelivery of the Aircraft. Therefore, the Lessee has taken possession of the Aircraft on August 10, 2025.",Yes," The Lessee takes possession of the Aircraft upon delivery by the Lessor and acceptance of the Aircraft by the Lessee, as outlined in Section 3 of the lease agreement. This typically occurs at London Heathrow Airport on the Delivery Date specified in the agreement.",Specific/Factual,"The Lessee, BlueJet Airways Corp., takes possession of the Aircraft on the Delivery Date, which is specified as September 15, 2025. This date marks the point at which the Lessee is responsible for the condition of the Aircraft and can begin utilizing it for commercial charter services. 

Upon taking possession, the Lessee is required to inspect the Aircraft and sign the Certificate of Delivery Technical Acceptance, confirming that the Aircraft meets the specifications outlined in the lease agreement. This process ensures that both parties acknowledge the Aircraft's condition at the time of delivery and acceptance. 

In summary, the key date for the Lessee's possession of the Aircraft is September 15, 2025, following the completion of the delivery process.",tensor(0.9461),No
contract sample-2.pdf,From which date is the Lessee responsible for the Aircraft's condition?,The Lessee shall take possession of the Aircraft on the Delivery Date and shall be responsible for its condition from that date onward.,8,No," The Lessee is responsible for the Aircraft's condition from the date of taking possession under the lease agreement. However, the Lessee is required to return the Aircraft in a certain condition upon expiration or termination of the lease. The Aircraft must meet specific conditions for return, such as no major damage to the airframe, engines, avionics, or interior, and no structural damage to the exterior. The Lessee is also responsible for all costs associated with maintaining, repairing, and operating the Aircraft, as well as procuring and maintaining comprehensive aviation insurance coverage throughout the lease term.",No," The Lessee is responsible for the aircraft's condition from the date they take possession of the aircraft under the lease agreement. They are required to maintain the aircraft in an airworthy condition, carry out all necessary repairs, and ensure that all maintenance is conducted by certified and approved maintenance organizations. The Lessee is also responsible for obtaining and maintaining comprehensive aviation insurance coverage throughout the lease term. In the event of any changes in regulations or requirements, the Lessee must implement any required modifications or adjustments at their own expense. Upon termination of the lease, the aircraft must meet certain conditions for return, including no major damage or structural issues, and all necessary documentation must be provided.",Specific/Factual,"The Lessee is responsible for the Aircraft's condition starting from the Delivery Date, which is specified as August 10, 2025, unless otherwise mutually agreed in writing by both parties. This means that from that date onward, the Lessee must ensure that the Aircraft is maintained in an airworthy condition and adheres to all relevant regulations and standards. 

The responsibility includes not only the general upkeep of the Aircraft but also compliance with all maintenance obligations outlined in the agreement. This encompasses routine and scheduled maintenance, repairs, and inspections, ensuring that the Aircraft remains suitable for commercial operations throughout the Lease Term.",tensor(0.9564),No
contract sample-2.pdf,For what purpose must the Lessee use the Aircraft?,"The Lessee agreesto utilize the Aircraft exclusively for commercial charter services and must adhere to all relevant laws, regulations, and aviation safety standards in each jurisdiction in which the Aircraft operates.",8,Yes," The Lessee is required to use the aircraft for lawful purposes as outlined in the lease agreement, such as commercial passenger transport or cargo operations. They must maintain full operational control and agree not to use the aircraft for illegal activities, including transporting unlawful goods or materials, conducting unauthorized flights, or engaging in illegal smuggling or trafficking. The aircraft must be based at London Heathrow Airport, and any modifications or alterations must be approved by the Lessor in writing. Upon the expiration or termination of the lease, the aircraft must be returned in good condition, with all necessary documentation. The Lessee is responsible for paying all taxes, duties, fees, and other charges related to the aircraft's possession, use, or operation. They must also comply with all applicable environmental and safety regulations and ensure the aircraft is properly registered or deregistered with relevant civil aviation authorities. The Lessee agrees to register the aircraft in the name of the Lessor and take all reasonable actions to protect the Lessor's ownership and security interest in the aircraft against third-party claims.",Yes," The Lessee is required to use the Aircraft only for lawful purposes, as outlined in the lease agreement, such as commercial passenger transport or cargo operations. They must maintain full operational control and agree not to use the Aircraft for illegal activities, including transporting unlawful goods or materials, conducting unauthorized flights, or engaging in illegal smuggling or trafficking. The Lessee is also responsible for ensuring the Aircraft is properly registered and that no liens or encumbrances are registered against it without the Lessor's consent. They must also take reasonable actions to protect the Lessor's ownership and security interest in the Aircraft against third-party claims. Upon the expiration or termination of the lease, the Aircraft must meet certain conditions for return, including having no major damage or defects, fully functional avionics, and being repainted with no structural damage. The Lessee is responsible for paying all taxes, duties, fees, and other charges related to the Aircraft's possession, use, or operation. They must also comply with all applicable environmental laws and regulations and ensure all necessary safety equipment is on board and in good working order.",Specific/Factual,"The Lessee is required to use the Aircraft exclusively for commercial charter services. This stipulation is outlined in Section 6 of the Aircraft Lease Agreement, which emphasizes that the Lessee must adhere to all relevant laws, regulations, and aviation safety standards in each jurisdiction where the Aircraft operates. 

Additionally, the Lessee must maintain full operational control over the Aircraft throughout the Lease Term, which includes the selection and management of pilots, crew, and passengers. The agreement also specifies that the Aircraft should not be used for any illegal purposes, such as transporting unlawful goods or conducting unauthorized flights. 

In summary, the primary purpose of the Aircraft's use is for legitimate commercial charter operations, ensuring compliance with all applicable aviation regulations and safety standards.",tensor(0.9635),No
contract sample-2.pdf,What must the Lessee adhere to when operating the Aircraft?,"The Lessee agreesto utilize the Aircraft exclusively for commercial charter services and must adhere to all relevant laws, regulations, and aviation safety standards in each jurisdiction in which the Aircraft operates.",8,Yes," The Lessee is required to adhere to all applicable local, national, and international laws, rules, treaties, and regulations regarding the operation, use, registration, and maintenance of the Aircraft. This includes obtaining necessary licenses, permits, and certifications, ensuring the Aircraft is operated by licensed pilots and crew members, and implementing any required modifications or adjustments due to regulatory changes. The Lessee is also responsible for maintaining accurate records, securing comprehensive aviation insurance, and paying all taxes, duties, fees, and charges related to the Aircraft's operation. Additionally, the Lessee must protect the Lessor's ownership and interest in the Aircraft, and ensure environmental and safety compliance. The Lessee is responsible for maintaining the Aircraft in an airworthy condition through routine and scheduled maintenance, repairs, and inspections.",Yes," The Lessee is required to adhere to all applicable local, national, and international laws, rules, treaties, and regulations regarding the operation, use, registration, and maintenance of the Aircraft. This includes obtaining necessary licenses, permits, and certifications, complying with aviation authorities' regulations, and ensuring the Aircraft is operated by licensed and qualified pilots. The Lessee is also responsible for maintaining the Aircraft in an airworthy condition, performing all routine and scheduled maintenance, and cooperating with the Lessor for registration and protection of the Lessor's rights. The Lessee must ensure accurate maintenance records are kept and provide comprehensive aviation insurance coverage. The Lessee is responsible for paying all taxes, duties, fees, and charges related to the Aircraft's possession, use, or operation. The Lessee must comply with environmental laws and regulations and ensure all necessary safety equipment is on board and in good working order.",Procedural,"### Adherence Requirements for the Lessee in Operating the Aircraft

When operating the Aircraft, the Lessee is required to adhere to several critical regulations and standards to ensure compliance and safety. These obligations are outlined in the Aircraft Lease Agreement and include the following key points:

#### 1. **Compliance with Laws and Regulations**
The Lessee must comply with all applicable local, national, and international laws, rules, treaties, and regulations governing the operation, use, registration, and maintenance of the Aircraft. This includes, but is not limited to, regulations established by:

- **Transportation Safety Administration (TSA)**
- **Civil Aviation Authority (CAA)**
- **International Air Transport Association (IATA)**

The Lessee is responsible for securing and maintaining all necessary licenses, permits, and certifications required for the operation of the Aircraft, which may include commercial pilot licenses and airworthiness certificates.

#### 2. **Operational Control**
The Lessee retains complete operational control over the Aircraft throughout the Lease Term. This includes the selection and management of pilots, crew, and all passengers. The Lessee must ensure that only licensed and qualified pilots and crew members operate the Aircraft, in accordance with the Aircraft's operational manuals and safety guidelines.

#### 3. **Maintenance Obligations**
The Lessee is obligated to maintain the Aircraft in an airworthy condition, consistent with the standards required by the manufacturer and all applicable aviation authorities. This includes performing all routine and scheduled maintenance, repairs, and inspections, such as:

- A-checks, B-checks, C-checks, and D-checks as specified in the Aircraft’s maintenance schedule.
- Engine inspections and overhauls as required by the engine manufacturer’s maintenance program.
- Landing gear inspections and refurbishments as specified by the manufacturer or regulatory authorities.

The Lessee must also maintain accurate and up-to-date maintenance records and logs, which should be made available to the Lessor for inspection upon request.

#### 4. **Insurance Requirements**
The Lessee is required to procure and maintain comprehensive aviation insurance coverage throughout the Lease Term. This insurance must include:

- **Hull All-Risk Insurance**: Covering the full replacement value of the Aircraft against physical loss or damage.
- **Third-Party Liability Insurance**: Providing coverage for bodily injury, death, and property damage to third parties, with minimum liability limits of $600 million per occurrence.
- **Passenger Liability Insurance**: Covering the Lessee's legal liability for bodily injury or death of passengers.

All insurance policies must name the Lessor as an additional insured and loss payee, and include provisions for prior written notice to the Lessor before any cancellation or significant modification.

#### 5. **Reporting and Record Keeping**
The Lessee is required to keep comprehensive flight logs, maintenance records, and technical documentation as mandated by relevant aviation authorities. Regular reports on the Aircraft's usage, detailing flight hours, cycles, and any significant incidents, must be submitted to the Lessor quarterly.

### Conclusion
In summary, the Lessee must adhere to a comprehensive set of regulations and obligations when operating the Aircraft. This includes compliance with laws, maintaining operational control, ensuring proper maintenance, securing adequate insurance, and keeping detailed records. These measures are essential for ensuring the safe and legal operation of the Aircraft throughout the Lease Term.",tensor(0.9289),No
contract sample-2.pdf,Who retains operational control over the Aircraft during the Lease Term?,"The Lessee shall retain complete operational control over the Aircraft throughout the Lease Term, including the selection and management of pilots, crew, and all passengers.",8,Yes," Based on the information provided in the lease agreement, the operational control of the aircraft during the lease term is retained by the lessee. The lessee is responsible for operating the aircraft in accordance with the manufacturer's operating manual, approved operating limits and flight performance standards, and for any specific purposes outlined in the lease. The lessee is also required to comply with all applicable local, national, and international laws, rules, treaties, and regulations governing the operation, use, registration, and maintenance of the aircraft. The lessee is required to provide regular operational reports to the lessor, including monthly flight reports, quarterly maintenance reports, and annual financial statements. The lessee is also responsible for paying all taxes, duties, fees, and other charges imposed by any governmental authority in connection with the possession, use, or operation of the aircraft. The lessor has the right to inspect the aircraft at any reasonable time and with reasonable notice.",Yes," Based on the information provided in the lease agreement, the operational control of the aircraft during the lease term is retained by the lessee. The lessee is responsible for operating the aircraft in accordance with the manufacturer's operating manual, approved operating limits and flight performance standards, and for any specific purposes outlined in the lease. The lessee is also required to comply with all applicable local, national, and international laws, rules, treaties, and regulations governing the operation, use, registration, and maintenance of the aircraft. The lessee is required to provide regular operational reports to the lessor, including monthly flight reports, quarterly maintenance reports, and annual financial statements. The lessee is also responsible for paying all taxes, duties, fees, and other charges imposed by any governmental authority in connection with the possession, use, or operation of the aircraft. The lessor has the right to inspect the aircraft at any reasonable time and with reasonable notice.",Specific/Factual,"During the Lease Term, the Lessee retains complete operational control over the Aircraft. This includes the authority to select and manage pilots, crew, and all passengers. The Lessee is responsible for ensuring that the Aircraft is operated in compliance with all relevant laws, regulations, and aviation safety standards applicable in each jurisdiction where the Aircraft operates.

The Lessee is also obligated to utilize the Aircraft exclusively for commercial charter services and must adhere to the manufacturer's operating manual and approved operating limits. Furthermore, the Lessee is prohibited from using the Aircraft for any illegal purposes, such as transporting unlawful goods or conducting unauthorized flights.

In summary, the Lessee has full operational control and is responsible for the Aircraft's use and compliance with applicable regulations throughout the duration of the lease.",tensor(0.9640),No
contract sample-2.pdf,Where will the Aircraft be based during the Lease Term?,Base Location: The Aircraft will be stationed at London Heathrow International Airport or any alternative location mutually agreed upon in writing by both parties.,8,Yes," The Aircraft will be based at London Heathrow International Airport during the Lease Term, unless otherwise agreed upon in writing by both parties.",Yes, The Aircraft will be based at London Heathrow International Airport or any alternative location mutually agreed upon in writing by both parties during the Lease Term.,Specific/Factual,"The Aircraft will be based at London Heathrow International Airport during the Lease Term. However, the Lessee and Lessor may mutually agree in writing to an alternative location if necessary. This arrangement ensures that the Aircraft is stationed at a major international airport, facilitating its use for commercial charter services as outlined in the lease agreement.

Additionally, the Lessee is required to notify the Lessor in writing before moving the Aircraft to any other jurisdiction or country, ensuring that both parties are informed of the Aircraft's location throughout the lease period. This provision is crucial for maintaining operational control and compliance with relevant aviation regulations.",tensor(0.9341),No
contract sample-2.pdf,"Can the base location of the Aircraft be changed? If so, how?","Yes, the base location of the aircraft can be changed. It is initially stationed at London Heathrow International Airport, but it can be moved to an alternative location if both parties mutually agree in writing.",8,Yes," Yes, the base location of the Aircraft can be changed with the Lessor's written consent. The agreement states that the Aircraft will be stationed at London Heathrow International Airport or any alternative location mutually agreed upon in writing by both parties.",Yes," The base location of the Aircraft can be changed with the prior written consent of the Lessor. The Aircraft is initially based at London Heathrow Airport, and the Lessee must notify the Lessor in writing before moving it to any other jurisdiction or country.",Procedural,"The base location of the Aircraft can potentially be changed, but this would typically require the Lessee to follow specific procedures outlined in the lease agreement. While the provided documents do not explicitly mention the process for changing the base location, there are general practices that are often included in such agreements.

### General Considerations for Changing the Base Location

1. **Written Consent**: The Lessee would likely need to obtain prior written consent from the Lessor before making any changes to the base location of the Aircraft. This is a common requirement in lease agreements to ensure that the Lessor is aware of and approves the new location.

2. **Notification**: The Lessee may be required to notify the Lessor of the intended change in base location, providing details such as the new location and the reasons for the change.

3. **Compliance with Regulations**: The new base location must comply with all relevant aviation regulations and safety standards. The Lessee would need to ensure that the Aircraft can be operated safely and legally from the new location.

4. **Impact on Operations**: The Lessee should consider how the change in base location might affect operational aspects, such as maintenance, crew availability, and logistical support.

5. **Documentation**: Any change in the base location may require updates to documentation, including registration and insurance policies, to reflect the new operational base.

### Conclusion

While the specific lease agreement does not detail the process for changing the base location, it is essential for the Lessee to seek the Lessor's consent and ensure compliance with all applicable regulations. It is advisable for the Lessee to review the lease agreement thoroughly and consult with legal counsel if necessary to navigate this process effectively.",tensor(0.9137),No
