Contract,Question,Answer,Source Page No,Evaluation Azure,Result Azure,Evaluation Chroma,Result Chroma,Question Category,LightRAG_naive_response,lightRag_similarity_scores,LightRAG_evaluation_result
contract sample-1.pdf,what type of APU is on the aircraft and is there a serial number?,GTCP131-9B with serial number H-12345,31,Yes," The type of APU (Auxiliary Power Unit) on the aircraft is a GTCP131-9B manufactured by Honeywell Aerospace, and the serial number is H-12345.",Yes," The type of APU (Auxiliary Power Unit) on the aircraft is a GTCP131-9B manufactured by Honeywell Aerospace, and its serial number is H-12345.",Specific/Factual,"### APU Specifications

The aircraft is equipped with an **Auxiliary Power Unit (APU)** manufactured by **Honeywell Aerospace**. The specific type and model of the APU is the **GTCP131-9B**. 

### Serial Number

The serial number for this APU is **H-12345**. 

This information is crucial for maintenance and operational records, ensuring that the APU can be tracked for service history and compliance with regulatory standards.",tensor(0.8653),No
contract sample-1.pdf,What is the maximum takeoff weight?,"82,000 KGS",31,Yes," The maximum takeoff weight of the Boeing 737 MAX 8 aircraft, as specified in Exhibit A of the lease agreement, is 82,000 KGS.",No, I'm an intelligent assistant specialising in aircraft lease agreements. I'm unable to determine the maximum takeoff weight directly from the provided information. The tables only list various costs related to aircraft operation and maintenance.,Numerical,"The maximum takeoff weight (MTOW) for the Boeing 737 MAX 8 aircraft, as specified in the documents, is **82,000 kilograms (KGS)**. This weight is crucial for ensuring that the aircraft operates within safe limits during takeoff, affecting performance, fuel efficiency, and overall safety. 

In aviation, the MTOW is a critical parameter that must be adhered to, as exceeding this weight can lead to operational issues and potential safety hazards. It is determined by various factors, including the aircraft's design, structural integrity, and regulatory requirements. 

If you have any further questions about aircraft specifications or related topics, feel free to ask!",tensor(0.8493),No
contract sample-1.pdf,what is the engine type and model?,LEAP-1B,31,No," Based on the context provided, there is no explicit mention of the engine type and model in the given documents. Therefore, I cannot provide an answer to that question with the information available.",No, The table provided does not specify the engine type and model for the aircraft lease agreement.,Specific/Factual,"### Engine Type and Model

The aircraft specified in the documents is equipped with two (2) **Pratt & Whitney PW4000** engines. This information is consistent across both the Lease Supplement No. 1 and the Certificate of Delivery Technical Acceptance, confirming the engine type and model for the Boeing Voyager -737 aircraft bearing Manufacturer’s Serial Number 56789. 

### Summary

The Pratt & Whitney PW4000 series is known for its reliability and efficiency, making it a popular choice for various aircraft models. The inclusion of these engines indicates that the aircraft is designed for optimal performance in commercial aviation settings.",tensor(0.7783),No
contract sample-1.pdf,who manufactures the APU of aircraft?,Honeywell Aerospace,31,Yes, The APU (Auxiliary Power Unit) of the aircraft is manufactured by Honeywell Aerospace.,No, The documentation provided does not mention the manufacturer of the Auxiliary Power Unit (APU) of the aircraft.,Specific/Factual,"The Auxiliary Power Unit (APU) of the aircraft mentioned in the documents is manufactured by Honeywell Aerospace. The specific type and model of the APU is the GTCP131-9B, with the serial number H-12345. 

Honeywell Aerospace is known for producing a variety of aerospace components, including APUs, which provide power for aircraft systems while on the ground and during flight, ensuring that the aircraft can operate independently of ground power sources.",tensor(0.8824),No
contract sample-1.pdf,what is basic rent and mention the rent rate for the aircraft?,"“Basic Rent” refers to the fixed monthly payment the Lessee agrees to pay the Lessor for 
the lease of the Aircraft. The rent is $250,000 per month.",35,Yes," Basic rent refers to the fixed monthly payment the Lessee agrees to pay the Lessor for the lease of the Aircraft, as defined in Exhibit C, with a value of $250,000 per month.",Yes," Basic rent is a fixed monthly payment the Lessee agrees to pay the Lessor for the lease of the Aircraft. The rent rate is $250,000 per month as per the agreement.",Numerical,"### Basic Rent Overview

In the context of the Aircraft Lease Agreement between SkyHigh Leasing Ltd. (the Lessor) and Global Air Transport Inc. (the Lessee), ""Basic Rent"" refers to the fixed monthly payment that the Lessee is obligated to pay for the lease of the aircraft. This payment is a crucial component of the lease agreement, ensuring that the Lessor receives a consistent income for the use of the aircraft.

### Rent Rate for the Aircraft

The Basic Rent for the aircraft, specifically the Boeing Voyager -737, is set at **$250,000 per month**. This amount is payable in advance on the first business day of each month throughout the duration of the lease term, which is specified to be 60 months, commencing on the Delivery Date of August 1, 2024. 

This structured payment plan is designed to provide clarity and predictability for both parties involved in the lease agreement.",tensor(0.9543),No
contract sample-1.pdf,When the lease term is expiring?,"lease term expiring on July 19, 2029",35,Yes," The lease term for the aircraft begins on July 19, 2024, and ends on July 19, 2029. The lessee has the option to extend the lease term by 12 months, provided they give written notice to the lessor 90 days before the expiration of the original lease term. The certificate of delivery and technical acceptance was executed on July 19, 2024.

Default events under the agreement include failure to pay rent, breach of material covenant, and insolvency, bankruptcy, or liquidation. For insolvency, bankruptcy, or liquidation events, there is no cure period, and the lessor may immediately terminate the agreement and repossess the aircraft.

Upon the expiration or early termination of the lease, the lessee is responsible for returning the aircraft to the lessor in the condition outlined in the return condition clause and paying any additional costs incurred to meet return condition standards. The lessor has the right to audit the lessee's maintenance operations and records to ensure compliance with the agreement and may demand immediate corrective actions and seek reimbursement for any associated costs.

The term ""aircraft"" refers to the Boeing Voyager -737 aircraft, as further described in Exhibit A, including engines, avionics, components, and all associated equipment, with a current market value of $50,000,000. The basic rent is $250,000 per month, and the lease term is 60 months, commencing on July 19, 2024, and expiring on July 19, 2029. The security deposit is $500,000, and maintenance reserve payments are monthly payments made by the lessee to cover future maintenance and overhaul costs.",Yes," The lease term for the aircraft is 60 months, starting on July 19, 2024, and ending on July 19, 2029. The lessee has the option to extend the lease term by 12 months, provided they give written notice to the lessor 90 days before the expiration of the original lease term. The certificate of delivery and technical acceptance was executed on July 19, 2024. Upon the expiration or early termination of the lease, the lessee is responsible for returning the aircraft in the condition outlined in the return condition clause and paying for any necessary maintenance to meet those standards. The lessor has the right to audit the lessee's maintenance operations and records at any time to ensure compliance with the agreement. If the lessee is found non-compliant, the lessor may demand immediate corrective actions and seek reimbursement for any associated costs. The lessee is also responsible for providing renewal certificates or proof of replacement coverage for insurance policies at least 30 days before their expiration and notifying the lessor immediately in the event of any loss, damage, or occurrence giving rise to a claim under the insurance policies. If the lessee fails to maintain the required insurance coverage, the lessor may procure the insurance on behalf of the lessee, declare an event of default, or exercise any remedies available under Section 17. The lessor may terminate the agreement, take possession of the aircraft, or accelerate payments if the lessee fails to cure any default within the applicable cure period. Default events include failure to pay rent, breach of material covenant, insolvency, bankruptcy, or liquidation.",Specific/Factual,"The lease term expiration date is not explicitly stated in the provided documents. However, it is indicated that the Lessee must adhere to a maintenance schedule and return the Aircraft upon the expiration or termination of the Lease. 

To determine the specific expiration date, one would typically refer to the original lease agreement, which should outline the start date and duration of the lease term. If you have access to that information, you can calculate the expiration date based on the agreed-upon lease duration. 

If you need further assistance or have additional details about the lease, feel free to share!",tensor(0.8651),No
contract sample-1.pdf,what is Security Deposit?,"“Security Deposit” refers to the sum paid by the Lessee to the Lessor as a form of 
financial guarantee for the performance of obligations under the Lease Agreement.",35,Yes, A security deposit is a sum paid by the Lessee to the Lessor as a financial guarantee for the performance of obligations under the Lease Agreement. It is typically paid prior to the aircraft's delivery.,Yes, A Security Deposit is a sum paid by the Lessee to the Lessor as a form of financial guarantee for the performance of obligations under the Lease Agreement. It is typically paid prior to the delivery of the aircraft.,Descriptive,"### Security Deposit Overview

The **Security Deposit** is a financial guarantee that the Lessee pays to the Lessor as part of the lease agreement for the aircraft. This deposit serves as a form of assurance that the Lessee will fulfill their obligations under the terms of the lease.

### Key Details

- **Value**: The Security Deposit is set at **$500,000**. This amount is to be paid prior to the delivery of the aircraft.
- **Purpose**: The primary purpose of the Security Deposit is to protect the Lessor against any potential defaults or breaches of the lease agreement by the Lessee. It acts as a safeguard for the Lessor, ensuring that they have a financial cushion in case of any issues that may arise during the lease term.

### Importance in Lease Agreements

In lease agreements, the Security Deposit is a common practice, especially for high-value assets like aircraft. It provides the Lessor with a level of security and confidence that the Lessee is committed to maintaining the terms of the lease. Upon the successful completion of the lease term and fulfillment of all obligations, the Security Deposit is typically refunded to the Lessee, subject to any deductions for damages or unpaid amounts.

In summary, the Security Deposit is a crucial component of the lease agreement, ensuring both parties are protected and that the Lessee has a vested interest in adhering to the terms of the contract.",tensor(0.9413),No
contract sample-1.pdf,Explain Airframe Heavy Maintenance Reserves?,"The Lessee shall contribute to an Airframe Heavy Maintenance Reserve to account for 
costs related to major structural inspections and overhauls. The payment frequency is monthly and the amount is $10,000 per month.",37,Yes," Airframe Heavy Maintenance Reserves refer to a provision in an aircraft lease agreement where the Lessee makes monthly payments to a reserve fund to cover future costs related to major structural inspections and overhauls of the aircraft's airframe. The Lessee is required to contribute $10,000 per month to this reserve. The Lessor may draw from this reserve when major airframe inspections or overhauls are required.",Yes," Airframe Heavy Maintenance Reserves refer to a reserve fund established by the Lessee to cover costs related to major structural inspections and overhauls of the aircraft's airframe. The Lessee makes monthly contributions to this reserve, with a payment amount of $10,000 per month. The Lessor may draw from this reserve when major airframe inspections or overhauls are required.",Descriptive,"### Airframe Heavy Maintenance Reserves

Airframe Heavy Maintenance Reserves are a financial provision established within aircraft leasing agreements to cover the costs associated with major structural inspections and overhauls of the aircraft's airframe. These reserves are crucial for ensuring that the aircraft remains compliant with safety regulations and operational standards throughout its lease term.

#### Purpose and Importance

The primary purpose of the Airframe Heavy Maintenance Reserves is to allocate funds specifically for significant maintenance activities that are not part of routine upkeep. These activities may include:

- **Major Inspections**: Comprehensive checks that assess the structural integrity and overall condition of the aircraft.
- **Overhauls**: Extensive repairs or replacements of critical components that may be necessary after a certain number of flight hours or cycles.

By setting aside these reserves, both the lessor and lessee can ensure that the aircraft is maintained in a safe and airworthy condition, thereby minimizing the risk of unexpected costs arising from heavy maintenance needs.

#### Financial Structure

According to the leasing agreement, the lessee is required to make monthly contributions to the Airframe Heavy Maintenance Reserve. The amount specified for these reserves is **$10,000 per month**. This structured payment plan allows for predictable budgeting and financial planning for both parties involved in the lease.

#### Compliance and Accountability

The lessee is responsible for managing these reserves and ensuring that the funds are utilized appropriately for the intended maintenance activities. The lessor retains the right to audit the lessee’s maintenance operations and records to ensure compliance with the terms of the lease agreement. If the lessee fails to comply with maintenance requirements, the lessor may demand corrective actions and seek reimbursement for any associated costs.

In summary, Airframe Heavy Maintenance Reserves play a vital role in the maintenance and operational integrity of leased aircraft, ensuring that significant maintenance needs are anticipated and funded appropriately. This proactive approach helps maintain safety standards and operational efficiency throughout the lease term.",tensor(0.9358),No
contract sample-1.pdf,Is there any adjustments for maintenance payments?,"The Lessor reserves the right to adjust maintenance reserve payments every 12 months 
based on actual maintenance costs and industry standard rates. The Lessee shall be notified of any 
adjustments at least 60 days prior to the change taking effect.  Not to exceed a 10% increase annually unless mutually agreed by both parties.",38,Yes," Yes, there are adjustments for maintenance payments. The Lessor may require additional payments or reserves for deferred maintenance, and the maintenance reserve payments may be adjusted every 12 months based on actual maintenance costs and industry standard rates. The Lessee will be notified of any adjustments at least 60 days prior to the change taking effect, with the adjustment rate not to exceed a 10% increase annually unless mutually agreed by both parties. The Lessee will also be reimbursed for any major maintenance or overhauls that fall under the Lessor's responsibility or if the Lessor agrees to cover certain maintenance costs. Unscheduled maintenance costs are the responsibility of the Lessee.",Yes," Yes, there are adjustments for maintenance payments. The Lessor may require additional payments or reserves for deferred maintenance to cover increased risk or costs. Maintenance reserve payments may be adjusted every 12 months based on actual maintenance costs and industry standard rates, with a maximum increase of 10% annually unless agreed by both parties. The Lessee will be reimbursed for any major maintenance or overhauls that fall under the Lessor's responsibility or if the Lessor agrees to cover certain maintenance costs. Unscheduled maintenance costs are the responsibility of the Lessee.",Specific/Factual,"Yes, there are provisions for adjustments to maintenance payments as outlined in the lease agreement. The Lessor reserves the right to adjust the maintenance reserve payments every 12 months based on actual maintenance costs and industry standard rates. The Lessee will be notified of any adjustments at least 60 days prior to the change taking effect. Importantly, the adjustment rate is capped at a maximum increase of 10% annually unless both parties mutually agree to a different rate.

This adjustment mechanism ensures that the maintenance payments remain aligned with the actual costs incurred for maintaining the aircraft, reflecting any changes in the market or operational requirements. It is essential for the Lessee to stay informed about these potential adjustments to manage their financial obligations effectively throughout the lease term.",tensor(0.9548),No
contract sample-1.pdf,"what is the name of the lessor, lessee?",The lessor is SkyHigh Leasing Ltd and the name of lessee is Global Air Transport Inc.,1,No, The lessor is the party who owns and retains legal and beneficial title to the aircraft during the lease term. The lessee is the party who leases and uses the aircraft under the terms of the agreement.,No, The lessor is the party who owns and leases the aircraft to the lessee. The lessee is the party who uses the aircraft under the terms of the lease agreement.,Specific/Factual,"The names of the parties involved in the lease agreement are as follows:

- **Lessor**: SkyHigh Leasing Ltd., a company organized and existing under the laws of Ireland, with its principal office located at 123 Aviation Avenue, Dublin, Ireland.

- **Lessee**: Global Air Transport Inc., a company organized and existing under the laws of the United States, with its principal office located at 456 Jetway Boulevard, Houston, Texas, USA. 

This information is part of the Aircraft Lease Agreement made on July 19, 2024.",tensor(0.9503),No
contract sample-1.pdf,What is the name of the aircraft being leased?,Boeing Voyager -737,35,Yes," The name of the aircraft being leased is a Boeing Voyager -737, bearing Manufacturer's Serial Number 56789.",Yes," The aircraft being leased is a Boeing Voyager -737 with Manufacturer's Serial Number 56789, equipped with two Pratt & Whitney PW4000 engines.",Specific/Factual,The aircraft being leased is a **Boeing Voyager -737**. This information is specified in the Aircraft Lease Agreement between SkyHigh Leasing Ltd. and Global Air Transport Inc.,tensor(0.9062),No
contract sample-1.pdf,What is the Maximum Landing Weight?," 69,000 KGS",31,Yes," The Maximum Landing Weight (MLW) for the Boeing 737 MAX 8 aircraft, as specified in Exhibit A of the agreement, is 69,000 KGS.",No," flight</td><td>$500/hour</td></tr><tr><td>Airport Fees</td><td>Landing, parking, handling</td><td>Per use</td><td>$2,000 per landing</td></tr><tr><td>Crew Costs</td><td>Pilot and cabin crew salaries</td><td>Monthly</td><td>$100,000</td></tr></table> I'm unable to determine the Maximum Landing Weight from the provided information.",Numerical,"The Maximum Landing Weight (MLW) for the aircraft specified in the documents is 69,000 kilograms (KGS). This weight is crucial for ensuring safe landing operations, as it represents the maximum weight at which the aircraft can safely land without risking structural integrity or performance issues. 

In aviation, adhering to weight limits is essential for maintaining safety standards and operational efficiency. The MLW is determined based on various factors, including the aircraft's design, structural capabilities, and regulatory requirements.",tensor(0.8628),No
contract sample-1.pdf,What is Maximum Zero Fuel Weight?,"65,000 KGS",31,Yes," Maximum Zero Fuel Weight (MZFW) is a weight measurement for an aircraft that refers to the weight of the aircraft with no fuel on board. In the context of the provided lease agreement, the MZFW for the Boeing 737 MAX 8 with serial number 12345 is 65,000 KGS.",No," Maximum Zero Fuel Weight (MZFW) refers to the weight of an aircraft when all its fuel is expended. It is an important consideration in aircraft leasing and financing as it affects the aircraft's value and operating costs. MZFW is typically calculated by subtracting the weight of the fuel from the Maximum Takeoff Weight (MTOW) of the aircraft. MTOW is a specified weight limit for an aircraft at the start of a flight, which includes the weight of the aircraft, fuel, passengers, cargo, and other equipment.

In the context of the tables provided, the costs listed are not directly related to MZFW. However, fuel costs are an essential component of calculating MZFW as it is the weight of the fuel that is being considered.",Numerical,"The Maximum Zero Fuel Weight (MZFW) is a critical specification in aviation that refers to the maximum weight of an aircraft without any usable fuel on board. This weight includes the aircraft's structure, payload (passengers, cargo, and baggage), and any other items that are not fuel. The MZFW is essential for ensuring that the aircraft operates within safe limits, particularly during takeoff and landing.

In the context of the provided documents, the Maximum Zero Fuel Weight for the Boeing 737 MAX 8 aircraft is specified as **65,000 kilograms (KGS)**. This means that when the aircraft is loaded with passengers and cargo, but without any fuel, it should not exceed this weight to maintain safety and performance standards. 

Understanding the MZFW is crucial for flight planning and weight management, as exceeding this limit can lead to structural issues and affect the aircraft's performance during flight operations.",tensor(0.8398),No
contract sample-1.pdf,When is the delivery date and it's location? ,"The Delivery Date is July 19, 2024 and delivery location is  Shannon Airport, Ireland.",40,Yes," The delivery date for the aircraft is July 19, 2024, at Shannon Airport, Ireland. The aircraft shall be delivered in an airworthy condition, fully equipped with all necessary parts, components, and avionics, and in compliance with all applicable airworthiness directives and maintenance requirements. The Lessee has the right to conduct a pre-delivery inspection of the aircraft, including a review of all records and a physical inspection by its technical team or a third-party expert, within 5 business days prior to the scheduled Delivery Date. If the aircraft does not meet the agreed delivery conditions, the Lessee may refuse acceptance until necessary repairs or adjustments are made. The aircraft shall be delivered with engines and major components that are in compliance with the original equipment manufacturer's specifications and operational limits, including engines with less than 2,000 hours TSO and landing gear with less than 1,000 cycles. The aircraft shall be delivered with sufficient fuel and hydraulic fluids for the delivery flight.",No," Based on the information provided, the delivery conditions and certificate of delivery technical acceptance (Exhibit E and H1) should provide the delivery date and location. Please refer to these exhibits for the specific details.",Specific/Factual,"The delivery date for the Aircraft is set for **July 19, 2024**. The location for the delivery is **Shannon Airport, Ireland**. 

At the time of delivery, the Aircraft is required to be in an airworthy condition, fully equipped with all necessary parts, components, and avionics, and compliant with all applicable airworthiness directives and maintenance requirements. The Lessee has the right to conduct a pre-delivery inspection within five business days prior to the scheduled delivery date to ensure that the Aircraft meets the agreed conditions. 

If there are any issues with the Aircraft that prevent it from meeting the delivery conditions, the Lessee has the option to refuse acceptance until necessary repairs or adjustments are made.",tensor(0.9567),No
