Contract,Question,Answer,Source Page No,Evaluation Azure,Result Azure,Evaluation Chroma,Result Chroma,Question Category,LightRAG_naive_response,lightRag_similarity_scores,LightRAG_evaluation_result
contract sample-1.pdf,"If the Agreement is terminated after a Total Loss, what specific items must the Lessee return?","Upon termination, the Lessee must return any records, documents, or parts related to the aircraft that were not destroyed in the Casualty Occurrence.",17,Yes," In the event of a Total Loss, the Lessee is required to assign all rights to the insurance proceeds to the Lessor. The Lessee must also return any records, documents, or parts related to the Aircraft that were not destroyed in the Casualty Occurrence and pay any outstanding amounts owed under the lease agreement. If the Aircraft is temporarily unfit for use but not a total loss, the Lessee may provide a temporary replacement aircraft, subject to the Lessor's approval. Upon termination, the Aircraft must be returned in a condition that meets the requirements outlined in the Aircraft Return Checklist. Any components beyond the allowed operational limits must be replaced with parts of equal or better value. The Aircraft shall be returned with a minimum fuel quantity and all necessary fluids at operational levels. The return location and test flight are also specified in the agreement. If the Lessee fails to return the Aircraft by the expiration of the lease term, a daily penalty will apply.",Yes," In the event of a Total Loss, the Lessee is required to return any records, documents, or parts related to the Aircraft that were not destroyed in the Casualty Occurrence, and pay any outstanding amounts owed under the lease agreement, including Rent, Additional Rent, or other fees accrued up to the date of termination. The Lessee shall also assign all rights to the insurance proceeds to the Lessor. If the Lessee proposes to replace the Aircraft with a similar aircraft of comparable value, age, and condition, subject to the Lessor's prior written approval, the replacement aircraft must meet certain criteria, and all costs associated with its procurement, delivery, and registration shall be borne by the Lessee. The Aircraft shall be returned in a condition that meets the requirements outlined in the Aircraft Return Checklist, with a minimum fuel quantity for the ferry flight to the agreed return location and all necessary fluids at operational levels. The Lessor has the right to conduct a post-return test flight and inspection to verify the condition of the Aircraft. If the Lessee fails to return the Aircraft by the expiration of the Lease Term, the Lessee shall pay a daily penalty for each day the Aircraft is overdue. The Lessee shall not allow the Aircraft to become subject to any adverse legal process and shall indemnify the Lessor for any costs, losses, or damages incurred as a result.",Specific/Factual,"In the event of a Total Loss and subsequent termination of the Agreement, the Lessee is required to return specific items as outlined in the document. Here are the key provisions regarding the return of items:

### 1. **Insurance Proceeds Assignment**
Upon a Total Loss, the Lessee must assign all rights to the insurance proceeds to the Lessor. This includes amounts payable under various insurance policies such as Hull All-Risk Insurance and War Risk Insurance. The Lessee is responsible for notifying the insurance provider immediately and ensuring that all claims are submitted and processed in a timely manner.

### 2. **Documentation**
The Lessee must provide comprehensive documentation related to the Total Loss. This includes:
- Initial notification to the insurance provider.
- All claims and recovery rights assigned to the Lessor.
- Cooperation with the Lessor and insurers to facilitate the prompt settlement of claims.

### 3. **Use of Proceeds**
The Lessor has sole discretion over the use of the insurance proceeds, which may include:
- Settling any outstanding amounts owed by the Lessee under the Agreement.
- Repairing or replacing the Aircraft.

### 4. **Obligations Following Total Loss**
While the Aircraft itself may not be returned due to its Total Loss status, the Lessee must ensure that all necessary actions are taken to comply with the terms of the Agreement regarding the assignment of insurance proceeds and documentation.

### Conclusion
In summary, after a Total Loss, the Lessee is primarily responsible for assigning insurance proceeds to the Lessor and providing all necessary documentation related to the loss. The physical return of the Aircraft is not applicable in this scenario, but the Lessee must fulfill their obligations regarding the insurance and any outstanding liabilities.",tensor(0.9259),No
contract sample-1.pdf,"What condition must the engines meet when the aircraft is returned, and what records are required?","The engines must be in mid-life status with no major defects. The required documentation includes engine overhaul records, and the engines must meet performance criteria.",26,Yes, The engines must be in mid-life status and have no major defects when the aircraft is returned. Engine overhaul records are required to ensure that the engines meet the performance criteria.,Yes," When returning an aircraft at the end of a lease, the engines must be in mid-life status with no major defects. Engine overhaul records are required to ensure that the engines meet the performance criteria.",Specific/Factual,"When the aircraft is returned, the engines must meet specific operational limits as outlined in the lease agreement. Each engine should have at least **1,500 flight hours** or **750 cycles** remaining before the next major overhaul is required. Additionally, the aircraft must be returned with no engine or Auxiliary Power Unit (APU) exceeding **10% of its allowable time between overhaul (TBO)**. This ensures that the engines are in good operating condition and do not require immediate major repairs.

In terms of documentation, the Lessee is required to provide complete maintenance records for the aircraft, engines, and components. This includes proof of compliance with all applicable airworthiness directives (ADs) and service bulletins (SBs) issued by the relevant aviation authorities. These records are crucial for verifying that all scheduled maintenance has been completed and that the aircraft is returned in an airworthy condition, free of any liens, and suitable for immediate commercial operation. 

Overall, the return conditions emphasize the importance of maintaining the aircraft and its components to ensure safety and compliance with aviation standards.",tensor(0.8880),No
contract sample-1.pdf,"What condition must the airframe be in upon return of the aircraft, and what documentation is required?","The airframe must have no major damage, only routine wear. The required documentation includes the last 3 years of maintenance logs, which must be up to date.",26,Yes," Upon the return of the aircraft at the end of the lease, the airframe must be in good condition with no major damage and only routine wear. The last three years of maintenance logs must be up-to-date and provided as required documentation. The engines should be at mid-life status with no major defects, and engine overhaul records must be available. Avionics should be fully functional with the latest software updates and calibration records. The interior can have normal wear and tear, but major damage is the lessee's responsibility. The exterior must be repainted and in good condition with no structural damage, with inspection and repaint certificates provided as documentation.

Along with the aircraft, the lessee must return all flight logs, maintenance records, certificates of airworthiness, engine performance reports, and insurance policies in the specified formats. The interior must be in good condition, clean, and free from damage beyond normal wear and tear. All scheduled maintenance must be completed before return, with no overdue items or deferred tasks outstanding. The paint must be free of significant defects, and the aircraft must be returned with all original equipment and configuration as at the time of delivery. Any missing items or components must be replaced by the lessee before return. Engines and major components, including engines, APU, and landing gear, must be within operational limits. Any components beyond the allowed operational limits must be replaced with parts of equal or better value before returning the aircraft.",Yes," The airframe of the aircraft upon return must be in good condition with no major damage and only routine wear. The last three years of maintenance logs are required documentation, and they must be up-to-date. The paint must be in good condition with no significant defects. The interior should be in good condition, clean, and free from damage beyond normal wear and tear. The Lessee is responsible for major damage and any necessary repairs before return. The aircraft must comply with all maintenance requirements, airworthiness directives, and service bulletins. The Lesse must return the following documents: all flight logs (digital and hard copy), complete maintenance records (digital and hard copy), original copies of certificates of airworthiness, digital copies of engine performance reports, and certified copies of insurance policies. Any custom branding applied during the lease term must be removed at the Lessee's cost.",Specific/Factual,"Upon the return of the aircraft, the airframe must meet specific conditions and documentation requirements as outlined in the lease agreement. 

### Airframe Condition at Return

1. **Airworthy Condition**: The aircraft must be returned in an airworthy condition, free of any liens, and suitable for immediate commercial operation. This includes compliance with the standards set by the aviation authorities governing its operation.

2. **Operational Limits**: The airframe should have less than 15,000 hours since the last heavy maintenance check. Additionally, each engine must have at least 1,500 flight hours or 750 cycles remaining before the next major overhaul is required, and the landing gear must have at least 1,000 cycles remaining before the next overhaul.

3. **Interior Condition**: The interior of the aircraft must be in good condition, clean, and free from any damage beyond normal wear and tear. All components, such as seats, flooring, and lavatories, must be fully functional and meet commercial passenger standards.

4. **Maintenance Compliance**: All scheduled maintenance due during the lease term must be completed before the aircraft is returned. There should be no overdue items or deferred maintenance tasks outstanding, and the aircraft must comply with all airworthiness directives (ADs) and service bulletins (SBs) issued by the relevant aviation authorities.

### Required Documentation

1. **Maintenance Records**: The Lessee must provide complete maintenance records for the aircraft, engines, and components. This includes proof of compliance with all applicable ADs and SBs.

2. **Return Condition Documentation**: Any documentation that verifies the aircraft's condition and compliance with the return standards must be presented. This may include inspection reports and maintenance completion certificates.

3. **Final Inspection Reports**: A comprehensive physical and records inspection will be conducted by the Lessor or an independent third-party inspector prior to acceptance of the returned aircraft.

In summary, the airframe must be in a well-maintained, airworthy condition with all necessary documentation to ensure compliance with the lease agreement's return conditions.",tensor(0.8998),No
contract sample-1.pdf,"What is required for the avionics to be considered acceptable for return, and what documentation is necessary?","The avionics must be fully functional, and the required documentation includes the latest software updates and calibration records. The avionics should also be up to date and properly calibrated.",26,Yes," For the avionics to be considered acceptable for return, they must be fully functional. The required documentation includes the latest software updates and calibration records to ensure they are up-to-date and calibrated.",Yes," To answer your query, for the avionics to be considered acceptable for return, they must be fully functional. The required documentation includes the latest software updates and calibration records to ensure the avionics are up-to-date and calibrated.",Specific/Factual,"### Avionics Acceptability for Return

For the avionics of the Aircraft to be considered acceptable upon return, they must meet specific operational and compliance standards. The following conditions must be satisfied:

1. **Operational Status**: All avionics systems must be fully operational. This means that they should function correctly without any defects that could impair their use in commercial operations.

2. **Compliance with OEM Specifications**: The avionics must comply with the original equipment manufacturer’s (OEM) specifications. This ensures that the systems are up to the required standards for safety and performance.

3. **Documentation of Maintenance**: The Lessee is required to provide complete maintenance records for the Aircraft, which includes documentation specifically related to the avionics systems. This documentation should demonstrate compliance with all applicable airworthiness directives (ADs) and service bulletins (SBs) issued by the relevant aviation authorities.

### Necessary Documentation

The following documentation is necessary to validate the condition and compliance of the avionics at the time of return:

- **Maintenance Records**: Detailed records showing all maintenance performed on the avionics systems during the lease term, including any repairs or replacements.

- **Compliance Certificates**: Certificates or documentation that confirm the avionics meet all applicable airworthiness directives and service bulletins.

- **Inspection Reports**: Any inspection reports conducted during the lease term that pertain to the avionics systems, demonstrating their operational status and compliance.

- **Final Acceptance Documentation**: Upon return, the Lessee must provide all necessary documents for the transfer of operational control back to the Lessor, which includes the avionics compliance documentation.

By ensuring that these conditions and documentation requirements are met, the Lessee can facilitate a smooth return process for the Aircraft, particularly concerning the avionics systems.",tensor(0.9022),No
contract sample-1.pdf,"What are the requirements for the aircraft's interior upon return, and who is responsible for major damage?","Normal wear and tear is acceptable for the interior, but the Lessee is responsible for any major damage. Cabin refurbishment records are required as documentation.",26,Yes," The requirements for the aircraft's interior upon return are that it should be in good condition, clean, and free from major damage. The lessee is responsible for repairing any damage before return. Cabin refurbishment records are required as proof. The exterior should be repainted and in good condition, with no structural damage. Inspection and repaint certificates are required. The lessee is responsible for major damage to the exterior. The airframe should have no major damage and routine wear, with last 3 years of maintenance logs required. Engines should be in mid-life status with no major defects, and engine overhaul records are required. Avionics should be fully functional with the latest software updates and calibration records. The paint must be free of significant defects. The airframe must have no major damage and routine wear, with last 3 years of maintenance logs required. Engines should be in mid-life status with no major defects, and engine overhaul records are required. Avionics should be fully functional with the latest software updates and calibration records. The interior should be in good condition with normal wear and tear acceptable, and cabin refurbishment records are required. The lessee is responsible for major damage to the interior. The exterior should be repainted and in good condition, with no structural damage. Inspection and repaint certificates are required. The airframe must have no major damage and routine wear, with last 3 years of maintenance logs required. Engines should be in mid-life status with no major defects, and engine overhaul records are required. Avionics should be fully functional with the latest software updates and calibration records. The paint must be free of significant defects. The aircraft must be returned with all original equipment and configuration as at the time of delivery. Any missing equipment or components must be replaced by the lessee before return. All major components, including engines, APU, and landing gear, must be within operational limits specified by the OEM. Engines must be in good operating condition with no major repairs required for at least 1,500 hours or 750 cycles. The aircraft must be returned with no engine or APU exceeding 10% of its allowable time between overhaul (TBO). If any components are beyond the allowed operational limits, the lessee must replace them with parts of equal or better value before returning the aircraft.",Yes," The requirements for the aircraft's interior upon return include it being in good condition, clean, and free from major damage beyond normal wear and tear. Seats, flooring, lavatories, and other cabin components must be fully functional and meet commercial passenger standards. Any damage to the interior, such as torn seats or broken panels, must be repaired at the lessee's expense before return.

The lessee is responsible for major damage to the aircraft's interior.

The aircraft must be returned with all original equipment and configuration as at the time of delivery, including avionics systems, seats and interior components, and operational safety equipment. Missing items or components must be replaced by the lessee at its own expense prior to return.

All major components, including engines, APUs, and landing gear, shall be within the operational limits specified by the OEM. Engines must be in good operating condition, with no major repairs required for at least 1,500 hours or 750 cycles. The aircraft must be returned with no engine or APU exceeding 10% of its allowable time between overhaul.

If any components are beyond the allowed operational limits, the lessee must replace them with parts of equal or better value before returning the aircraft.

The aircraft's exterior must be repainted in a neutral colour agreed upon by both parties or in the lessee's livery (if approved by the lessor). Any custom branding applied during the lease term must be removed prior to return at the lessee's cost. The paint must be free of significant defects, such as peeling or chipping, and suitable for continued commercial service.

The aircraft must comply with all airworthiness directives and service bulletins issued by the relevant aviation authorities. The lessee must provide complete maintenance records for the aircraft, engines, and components, including proof of compliance with all applicable ADs and SBs.

Inspection and repaint certificates are required for the exterior of the aircraft, which must be in good condition with no structural damage.",Specific/Factual,"### Requirements for Aircraft Interior Upon Return

When returning the aircraft, the Lessee must ensure that the interior meets specific conditions to comply with the return provisions outlined in the agreement. The interior of the aircraft must be in good condition, clean, and free from any damage beyond normal wear and tear. This includes ensuring that all components such as seats, flooring, lavatories, and other cabin elements are fully functional and meet commercial passenger standards.

#### Specific Conditions Include:
- **Operational Status**: All interior components must be operational and in compliance with the standards set by aviation authorities.
- **Condition**: The interior should be free from significant damage, which includes issues like torn seats or broken panels.
- **Repairs**: Any damage that exceeds normal wear and tear must be repaired at the Lessee's expense before the aircraft is returned.

### Responsibility for Major Damage

The Lessee is responsible for any major damage to the aircraft's interior that occurs during the lease term. This responsibility includes ensuring that the aircraft is returned in the condition specified in the return conditions clause. If there is any damage beyond normal wear and tear, the Lessee must cover the costs of repairs prior to the return of the aircraft. 

In summary, the Lessee must maintain the aircraft's interior in a condition suitable for immediate commercial operation and bear the costs for any necessary repairs due to major damage incurred during the lease period.",tensor(0.9169),No
contract sample-1.pdf,What documentation must be returned along with the aircraft in both digital and hard copy format?,"The following documents must be returned in both digital and hard copy format: * Flight Logs (all flights during the lease period), * Maintenance Records (complete maintenance history during the lease term).
",26,Yes," The lessee is required to return various documents along with the aircraft at the end of the lease term. These documents include flight logs (digital and hard copy), maintenance records (digital and hard copy), certificates of airworthiness (original copy), engine performance reports (digital copy), and insurance policies (certified copy). Additionally, certain exhibits such as aircraft specifications (A1), list of manuals, documents and records (B1), definitions and values (C1), maintenance payment provisions (D1), delivery conditions (E1), return conditions (F1), lease supplement No.1 (G1), certificate of delivery technical acceptance (H1), certificate of redelivery technical acceptance (I1), and deregistration power of attorney (J1) are also to be returned.",Yes," The lessee is required to return various documents along with the aircraft at the end of the lease term. These documents include flight logs (digital and hard copy), maintenance records (digital and hard copy), certificates of airworthiness (original copy), engine performance reports (digital copy), and insurance policies (certified copy). Additionally, certain exhibits such as aircraft specifications (A1), list of manuals, documents and records (B1), definitions and values (C1), maintenance payment provisions (D1), delivery conditions (E1), return conditions (F1), lease supplement No.1 (G1), certificate of delivery technical acceptance (H1), certificate of redelivery technical acceptance (I1), and deregistration power of attorney (J1) are also to be returned.",Specific/Factual,"### Documentation Required for Aircraft Return

When returning the aircraft, the Lessee must ensure that a comprehensive set of documentation is provided in both digital and hard copy formats. This documentation is crucial for verifying the aircraft's condition and compliance with the terms of the lease agreement. Below is a detailed list of the required documents:

#### 1. **Aircraft Maintenance Records**
   - Complete records detailing all maintenance performed on the aircraft, including scheduled and unscheduled maintenance.
   - Documentation of compliance with all applicable Airworthiness Directives (ADs) and Service Bulletins (SBs).

#### 2. **Certificates**
   - All relevant certificates pertaining to the aircraft's airworthiness and operational status.

#### 3. **Engineering Documentation**
   - Technical documents that provide insights into the aircraft's design and operational specifications.

#### 4. **Configuration Status**
   - Documentation that outlines the current configuration of the aircraft, including any modifications made during the lease term.

#### 5. **Historical Records**
   - A complete history of the aircraft, including previous ownership, maintenance history, and any incidents or accidents.

#### 6. **Engine Records**
   - Detailed records for each engine, including maintenance history, performance data, and compliance with overhaul requirements.

#### 7. **APU Records**
   - Documentation related to the Auxiliary Power Unit, including maintenance and operational records.

#### 8. **Aircraft Maintenance Status Summaries**
   - Summaries that provide an overview of the aircraft's maintenance status at the time of return.

#### 9. **Digital Formats**
   - All documents must be provided in a digital format that is easily accessible and readable, such as PDF files or other commonly used formats.

### Conclusion

The return of the aircraft must be accompanied by these essential documents to ensure compliance with the lease agreement and facilitate a smooth transition back to the Lessor. Both digital and hard copy formats are required to meet the documentation standards set forth in the agreement.",tensor(0.9368),No
