Contract,Question,Answer,Source Page No,Evaluation Azure,Result Azure,Evaluation Chroma,Result Chroma,Question Category,LightRAG_naive_response,lightRag_similarity_scores,LightRAG_evaluation_result
contract sample-2.pdf,What is a Security Deposit in the context of the Lease Agreement?,Definition: “Security Deposit” refersto the sum paid by the Lessee to the Lessor as a form of financial guarantee for the performance of obligations under the Lease Agreement.,35,Yes," In the context of an aircraft lease agreement, a Security Deposit refers to a sum paid by the Lessee to the Lessor as a financial guarantee for the performance of obligations under the Lease Agreement. It is typically paid prior to the Aircraft's delivery. The value of the Security Deposit is $600,000.",Yes," In the context of a lease agreement for an aircraft, a Security Deposit refers to a sum of money paid by the Lessee to the Lessor at or before the delivery of the aircraft as a guarantee for the performance of the Lessee's obligations under the lease agreement. It is typically refundable upon the termination of the lease, subject to deductions for any damages or unpaid rent. (Sections 14 and 16)",Descriptive,"### Security Deposit in the Lease Agreement

In the context of the Lease Agreement, a **Security Deposit** serves as a financial guarantee provided by the Lessee to the Lessor. This deposit is intended to ensure the Lessee's performance of obligations under the lease terms. Specifically, the Security Deposit is a sum of money that the Lessee agrees to pay prior to the delivery of the Aircraft.

#### Key Details of the Security Deposit:

- **Value**: The Security Deposit is set at **$600,000**.
- **Timing**: It must be paid **prior to the Aircraft’s delivery** to the Lessee.
- **Purpose**: The primary function of the Security Deposit is to protect the Lessor's interests in the event of any defaults or breaches of the Lease Agreement by the Lessee. This could include failure to pay rent, maintenance obligations, or any other terms outlined in the agreement.

The Security Deposit is a common practice in lease agreements, providing a layer of security for the Lessor while ensuring that the Lessee is committed to fulfilling their contractual obligations.",tensor(0.9369),No
contract sample-2.pdf,How much is the Security Deposit that the Lessee must pay?,"$600,000, to be paid prior to the Aircraft’s delivery.",35,Yes," The Security Deposit amount is $600,000. It is paid by the Lessee prior to the Aircraft's delivery.",Yes," The Security Deposit amount is $600,000, which the Lessee must pay prior to the Aircraft's delivery.",Numerical,"The Security Deposit that the Lessee must pay to the Lessor is $600,000. This amount serves as a financial guarantee for the performance of obligations under the Lease Agreement and is to be paid prior to the Aircraft’s delivery. 

This deposit is a common practice in lease agreements, ensuring that the Lessor has a form of security in case of any defaults or breaches of the lease terms by the Lessee. It is important for the Lessee to be aware of this requirement as it represents a significant upfront cost associated with the leasing of the Aircraft.",tensor(0.9028),No
contract sample-2.pdf,When must the Security Deposit be paid by the Lessee?,"Security Deposit Definition: “Security Deposit” refersto the sum paid by the Lessee to the Lessor as a form of financial guarantee for the performance of obligations under the Lease Agreement. Value: $600,000, to be paid prior to the Aircraft’s delivery.",35,Yes," The Security Deposit, worth $600,000, is to be paid by the Lessee before the Aircraft's delivery. There is no specific mention of a cure period for late payment of the Security Deposit. However, if the Lessee fails to pay on time, the Lessor may declare an event of default and exercise its remedies under Section 18. Late payment penalties of 2% per day may also apply. For non-payment defaults, the Lessee has a 30-day cure period to remedy the breach. If the Lessee fails to cure the breach within this period, the Lessor may terminate the agreement and repossess the Aircraft.",Yes," The Security Deposit, valued at $600,000, is payable by the Lessee prior to the Aircraft's delivery. The Maintenance Reserve Payments, amounting to $40,000 per month, are paid in addition to the Basic Rent. The Security Deposit acts as a financial guarantee for the Lessee's obligations under the Lease Agreement.

Regarding your query, the Security Deposit is typically paid prior to the Aircraft's delivery. However, the text does not explicitly state when the Lessee must pay the Security Deposit if there are deferred maintenance issues or other adjustments to the lease agreement. To determine the exact payment schedule in such cases, it would be necessary to consult the specific terms of the lease agreement or contact the Lessor for clarification.",Procedural,"The Security Deposit must be paid by the Lessee on or before the Delivery Date of the Aircraft. This requirement ensures that the Lessor has the necessary financial security in place prior to the Lessee taking possession of the Aircraft. The specific timing of this payment is crucial as it aligns with the commencement of the Lease Term, marking the Lessee's responsibility for the Aircraft from that point onward. 

In addition to the Security Deposit, the Lessee is also responsible for other payments, such as the Basic Rent and Maintenance Reserve Payments, which are typically due at the start of the Lease Term. This structured payment schedule is designed to protect the interests of the Lessor while ensuring that the Lessee is prepared for the financial obligations associated with the lease. 

Overall, timely payment of the Security Deposit is a critical aspect of the leasing agreement, reflecting the Lessee's commitment to fulfilling their obligations under the contract.",tensor(0.9367),No
contract sample-3.pdf,Who are the parties involved in the lease agreement?,"Lessor: CloudFleet Rentals Inc. (New Zealand), Lessee: AirWave Travel Ltd. (Singapore)",1,No," The parties involved in the aircraft lease agreement are the Lessor and the Lessee. The Lessor is the owner of the aircraft and grants the Lessee the right to use the aircraft under the terms of the agreement. The Lessee is responsible for making payments, maintaining the aircraft, and complying with all applicable laws and regulations. The Lessor has the right to take various actions in case of the Lessee's default, including accelerating payments, seeking damages, exercising set-off rights, and initiating legal proceedings. The agreement also outlines the procedures for assignment of rights, governing law, dispute resolution, and termination of the lease in case of total loss. The Lessee is required to protect the Lessor's rights, assist with deregistration or re-registration, comply with exportation or importation requirements, and provide further assurances to ensure the Lessor's ownership rights. The Lessee must comply with all applicable laws, secure necessary licenses and permits, and ensure the aircraft is operated by qualified pilots.",No," The parties involved in the aircraft lease agreement are the Lessor and the Lessee. The Lessor is the owner of the aircraft and grants the Lessee the right to use the aircraft under the terms of the agreement. The Lessee is responsible for complying with all applicable laws, regulations, and maintaining the aircraft during the lease term. The Lessor retains full legal and beneficial title to the aircraft and may exercise various rights in case of the Lessee's default, including accelerating payments, claiming damages, setting off rights, and initiating legal proceedings. The agreement also outlines provisions for assignment, governing law, dispute resolution, termination, and exportation or importation requirements.",Descriptive,,,
contract sample-3.pdf,What is the lease term for the aircraft?,The lease term is 72 months commencing on the Delivery Date.,3,No," The lease term for the aircraft is 60 months, commencing on October 5, 2024.",No," The lease term for the aircraft is 60 months, beginning on October 5, 2024.",Specific/Factual,,,
contract sample-3.pdf,What is the serial and registration number of the aircraft?,"Manufacturer's serial number 3456789, registration number G67890.",3,Yes, The HorizonJet 787 aircraft has the manufacturer's serial number 3456789 and registration number G67890.,Yes," The serial number of the aircraft is 3456789 and the registration number is G67890. The nose landing gear (NLG) is LG-54321-0001, left hand main landing gear (LH MLG) is LG-43210-0001, and right hand main landing gear (RH MLG) is LG-32100-0001. The basic rent is $220,000 per month, and the lease term is 60 months, commencing on October 5, 2024, and expiring on October 5, 2029. The security deposit is $660,000. The dispute resolution will be resolved through arbitration in accordance with the rules of the American Arbitration Association, with arbitration to be held in New York City. The aircraft is a HorizonJet 787 with a maximum take off weight (MTOW) of 90,000 KGS, maximum landing weight (MLW) of 75,000 KGS, and maximum zero fuel weight (MZFW) of 70,000 KGS. The engines are Rolls-Royce RB211-535 with serial numbers 9101 and 1121, and the auxiliary power unit (APU) is Honeywell HTF7000 with serial number APU-98765. The landing gear is manufactured by Collins Aerospace.",Specific/Factual,,,
contract sample-3.pdf,What is the basic rent for leasing the aircraft?,"$220,000 per month.",25,Yes," The basic rent for leasing the aircraft is $220,000 per month, payable in advance on the first business day of each month, as stated in Section 4.1 of the lease agreement.",Yes," The basic rent for leasing the aircraft is $220,000 per month, payable in advance on the first business day of each month. Additionally, there is a maintenance reserve payment of $50,000 per month.",Numerical,,,
contract sample-3.pdf,What is the delivery location of the aircraft?,Auckland International Airport.,27,Yes, The delivery location for the aircraft is Auckland International Airport.,Yes," The delivery location of the aircraft is at Auckland International Airport, unless otherwise agreed upon by both parties.",Specific/Factual,,,
contract sample-3.pdf,What are the additional costs incurred by the Lessee?,"Insurance ($2,500,000 annually), Maintenance ($50,000 monthly), Fuel ($550 per hour), Airport Fees ($2000 per landing).",4,No," The Lessee is responsible for various additional costs during the lease term. These costs include operational reporting, taxes and fees, and unscheduled maintenance. Operational reporting includes monthly flight reports, quarterly maintenance reports, and annual financial statements. Taxes and fees include sales tax on lease payments, property tax, and international fees. Unscheduled maintenance costs vary depending on the component requiring repair and the type of repair. The Lessee is also responsible for paying all taxes, duties, fees, and other charges imposed by any governmental authority in connection with the possession, use, or operation of the Aircraft. The Lessee is also responsible for complying with all applicable environmental laws and regulations related to the operation of the Aircraft and ensuring that all necessary safety equipment is on board and in good working order. The estimated annual amounts for some of these costs are provided in the text.",Yes," The Lessee is responsible for additional costs including insurance with an estimated annual amount of $2,500,000, maintenance reserve at $50,000 per month, fuel costs at $550 per hour, airport fees at $2,000 per landing, crew costs at $100,000 per month, taxes and fees such as sales tax, use tax, excise tax, airport landing fees, navigation charges, parking fees, and customs duties or import/export fees, environmental and safety compliance, and unscheduled maintenance costs. The Lessee is also responsible for indemnifying and holding harmless the Lessor from any tax liabilities or penalties arising from the Lessee's failure to comply with its tax obligations. The Lessee shall comply with all applicable environmental laws and regulations related to the operation of the Aircraft and ensure that all necessary safety equipment is on board and in good working order. The Lessee is responsible for covering the costs of any unscheduled maintenance. The Lessee is also responsible for paying sales tax at 7% on lease payments monthly in Texas, USA, property tax at 1.8% of aircraft value annually in Harris County, Texas, USA, and international fees that vary by airport/country per use.",Descriptive,,,
contract sample-3.pdf,What is the Lessee's obligation regarding operational control?,"The Lessee retains complete operational control, including crew selection and management.",4,Yes," The Lessee is responsible for maintaining full operational control of the aircraft during the lease term and ensuring it is operated for lawful purposes. They must adhere to the manufacturer's operating manual, approved operating limits, and flight performance standards. The Lessee is also prohibited from using the aircraft for illegal activities, such as transporting unlawful goods or materials, conducting unauthorized flights, or engaging in illegal smuggling or trafficking. The aircraft must be based at Auckland International Airport, and any moves to other jurisdictions or countries require the Lessee's written consent from the Lessor.

The Lessee cannot make any material modifications, alterations, or improvements to the aircraft without the Lessor's prior written consent, except for routine repairs and replacements required for airworthiness and regulatory compliance. They are responsible for implementing any required modifications or adjustments due to changes in regulations at their own expense.

The Lessee is responsible for maintaining the aircraft in an airworthy condition, performing all routine and scheduled maintenance, repairs, and inspections, and ensuring all repairs are carried out by certified and approved maintenance organizations. They must also pay all taxes, duties, fees, and other charges imposed by governmental authorities in connection with the aircraft's possession, use, or operation.

The Lessee must comply with all applicable environmental laws and regulations related to aircraft operation, ensuring necessary safety equipment is on board, and handling hazardous materials in accordance with safety regulations. They must provide regular operational reports to the Lessor, including monthly flight reports, quarterly maintenance reports, and annual financial statements.

The Lessee is responsible for maintaining accurate and up-to-date maintenance records, logs, and technical documents for the aircraft and making them available to the Lessor for inspection upon request. They must bear all costs associated with maintaining, repairing, and operating the aircraft, including labor, parts, materials, and regulatory fees.

The Lessee must procure and maintain comprehensive aviation insurance coverage throughout the lease term, covering various types of coverage.",Yes," The Lessee is responsible for maintaining operational control of the aircraft during the lease term and ensuring it is only used for lawful purposes as outlined in the lease agreement. They must provide regular operational reports, maintain the aircraft in an airworthy condition, and comply with all applicable environmental and safety regulations. The Lessee is also responsible for paying all taxes, duties, fees, and other charges imposed by any governmental authority in connection with the possession, use, or operation of the aircraft. They must obtain the Lessor's prior written consent before making any material modifications or alterations to the aircraft, and maintain accurate and up-to-date maintenance records. The Lessee is also required to procure and maintain comprehensive aviation insurance coverage throughout the lease term.",Descriptive,,,
contract sample-3.pdf,What type of maintenance is required for the aircraft?,"A-checks, B-checks, C-checks, and D-checks according to the aircraft’s maintenance schedule.",5,No," The aircraft requires various types of maintenance as outlined in the maintenance schedule and as required by the manufacturer and regulatory authorities. This includes line maintenance every 500 flight hours, heavy maintenance every 2 years, and engine overhauls every 5,000 cycles. The Lessee is responsible for ensuring all repairs are carried out by certified and approved maintenance organizations and that the aircraft is operated in accordance with any Airworthiness Directives, Service Bulletins, and Mandatory Modifications. The Lessee must also maintain accurate and up-to-date maintenance records, logs, and technical documents for the aircraft.",No," The aircraft requires various types of maintenance as outlined in the maintenance schedule provided. This includes line maintenance every 500 flight hours, heavy maintenance every 2 years, and engine overhauls every 5,000 cycles. The Lessee is responsible for ensuring all repairs are carried out by certified and approved maintenance organizations and that the aircraft is operated in accordance with any Airworthiness Directives, Service Bulletins, and Mandatory Modifications issued by the manufacturer or aviation authorities. The Lessee is also required to maintain accurate and up-to-date maintenance records, logs, and technical documents for the aircraft.",Descriptive,,,
contract sample-3.pdf,What is the late payment penalty for overdue amounts,2% of the overdue amount for each day beyond the due date.,20,Yes, The late payment penalty for overdue amounts under the aircraft lease agreement is 2% of the overdue amount for each day the payment remains unpaid beyond the due date.,Yes, The late payment penalty for overdue amounts under the aircraft lease agreement is 2% of the overdue amount for each day the payment remains unpaid beyond the due date.,Numerical,,,
contract sample-3.pdf,What is the minimum third-party liability coverage required?,$500 million per occurrence.,6,Yes," The Lessee is required to maintain third-party liability insurance with a minimum coverage of $500 million per occurrence for bodily injury, death, or property damage caused to third parties. This coverage must include liabilities arising from ground handling operations, passenger-related claims, and damage caused to airport property or other aircraft. Additionally, the Lessee must maintain war risk insurance with coverage for confiscation, seizure, or nationalization of the Aircraft by government or military forces, with a minimum coverage of $100 million or as specified by the Lessor. The Lessee must also maintain cargo and baggage liability insurance, with coverage limits consistent with the value of the cargo carried and applicable laws governing cargo liability. All insurance policies must name the Lessor as an additional insured and loss payee, and provide a 30-day prior written notice for cancellation or material change in terms or coverage.",Yes," The Lessee is required to maintain third-party liability insurance with a minimum coverage of $500 million per occurrence for bodily injury, death, or property damage caused to third parties. This coverage must include liabilities arising from ground handling operations, passenger-related claims, and damage caused to airport property or other aircraft. Additionally, war risk insurance is required with coverage limits consistent with the value of the cargo carried and applicable laws governing cargo liability, and minimum coverage of $1,500 per passenger for personal baggage. The Lessee must also maintain ground risk insurance for the Aircraft when it is not in motion, with coverage for full replacement value or repair costs if the Aircraft is damaged while grounded.

All insurance policies required under the lease agreement must name the Lessor as an additional insured and loss payee, be issued by reputable insurance carriers with an A.M. Best rating of A or better, and include a waiver of subrogation in favor of the Lessor. The policies must also be primary and non-contributory, providing full coverage without reduction by other insurance the Lessor may carry.

The Lessee is also required to maintain war risk insurance with coverage for losses arising from war, terrorism, hijacking, sabotage, unlawful seizure of the Aircraft, and other war-related perils, with coverage limits of no less than $100 million or as specified by the Lessor. The policy should also cover confiscation, seizure, or nationalization of the Aircraft by government or military forces, and civil commotions, riots, and other violent disturbances. The Lessee must maintain crew liability insurance with a minimum coverage of $50 million per occurrence, and cargo and baggage liability insurance with coverage limits consistent with the value of the cargo carried and applicable laws governing cargo liability.

Each insurance policy must include a 30-day prior written notice provision requiring the insurer to notify the Lessor in writing before any cancellation, non-renewal, or material change in the terms or coverage of the policy. In cases where war risk coverage is reduced or cancelled due to an increase in hostilities or political unrest, the insurer must provide seven days' notice to the Lessor, with the Lessee taking immediate steps to replace or restore the required coverage.",Numerical,,,
